{
  "schema": "forklet/receipt/1",
  "synthetic": true,
  "engine": "classical recurrent toy model",
  "stateIdType": "FNV-1a debug checksum, not a cryptographic proof",
  "stateId": "e160c3b6",
  "config": {
    "seed": 17,
    "horizon": 96,
    "forkAt": 24,
    "scenario": "bulletin",
    "duration": 18,
    "feeRate": 0.003
  },
  "summary": {
    "seed": 17,
    "scenario": "bulletin",
    "forkAt": 24,
    "horizon": 96,
    "stateId": "e160c3b6",
    "firstActionDifference": 25,
    "disagreements": 19,
    "comparedDecisions": 72,
    "meanTV": 0.22046119657953625,
    "maxHiddenL2": 2.96019951068117,
    "finalEquityA": 9.694819893898078,
    "finalEquityB": 10.273489257871015,
    "feesA": 0.04491195429876742,
    "feesB": 0.042875801904543945
  },
  "checkpoint": {
    "schema": "forklet/state/1",
    "modelVersion": "forklet/rnn8/1",
    "seed": 17,
    "tick": 24,
    "model": {
      "input": [
        [
          -0.28793294336646796,
          0.7230351426638663,
          0.2718524776864797,
          0.2431259538978338,
          -0.220395426498726,
          -0.05363627700135112,
          -0.24443995384499428,
          0.19927503545768557
        ],
        [
          -0.18813178273849188,
          -0.2962193533778191,
          -0.23331390609964728,
          0.02353233704343438,
          -0.20331415864638983,
          0.22359597855247557,
          0.0612246997654438,
          0.29025598042644557
        ],
        [
          -0.16017177519388495,
          0.8614822427276522,
          -0.21235500862821935,
          0.11589963790029287,
          -0.06651783892884851,
          -0.036463456135243176,
          -0.1328177239280194,
          0.08664746931754053
        ],
        [
          0.26890698121860623,
          -0.28344873194582765,
          -0.09868308235891163,
          -0.14125629574991763,
          -0.1786037805955857,
          0.2718445991165936,
          -0.05556752518750727,
          0.11743018515408038
        ],
        [
          -0.2069450649898499,
          0.9800401971675454,
          -0.1341204194817692,
          0.2012055129278451,
          -0.09269710360094904,
          0.15811643195338546,
          -0.2721702419221401,
          0.15076498137786984
        ],
        [
          0.28681067093275486,
          -0.3082154566422105,
          0.27857380025088785,
          0.11463022450916469,
          -0.1727148846723139,
          0.19916340205818414,
          0.14515879531390966,
          0.2059706232044846
        ],
        [
          0.040137517545372245,
          0.40066308453679084,
          0.2593684927560389,
          0.15370277934707702,
          0.000833144411444664,
          -0.24851445229724048,
          -0.13734408016316593,
          0.0669743722770363
        ],
        [
          -0.018145277816802263,
          -0.6203810104168952,
          -0.06856523067690432,
          -0.04544844129122794,
          -0.05005527553148568,
          -0.07636086218990386,
          0.02802459276281297,
          -0.22851272486150265
        ]
      ],
      "recurrent": [
        [
          0.48,
          -0.02771177695132792,
          0.05602434910833835,
          0.017348752878606318,
          0.03851737330667675,
          -0.02037117320112884,
          -0.058337752427905794,
          0.006846105884760618
        ],
        [
          -0.054743397329002616,
          0.48,
          0.01933349090628326,
          -0.049509015083312985,
          0.027791952146217228,
          0.04926578524522483,
          0.013774331342428923,
          -0.0357439084444195
        ],
        [
          -0.028795645600184796,
          -0.04600081491284072,
          0.48,
          -0.035514716645702715,
          -0.012767519429326057,
          0.05113866870291531,
          -0.00447160399518907,
          0.01760079899802804
        ],
        [
          0.0013583333417773245,
          0.028121470380574463,
          -0.055554673355072734,
          0.48,
          0.03187256122939289,
          0.020268777552992105,
          0.04577377052977681,
          -0.046630464121699335
        ],
        [
          0.0373118275590241,
          0.04345102658495307,
          0.026021713614463805,
          0.035606200592592355,
          0.48,
          0.03730358976870775,
          -0.05883347494527697,
          -0.04456833684816956
        ],
        [
          0.012346403505653143,
          0.009655063077807426,
          0.03443352704867721,
          -0.038308162204921246,
          -0.005812321901321411,
          0.48,
          0.0143492042273283,
          0.0548539153765887
        ],
        [
          -0.017426626542583108,
          -0.03120142157189548,
          0.050345368897542354,
          -0.03758512339554727,
          -0.03301724843680859,
          0.016020408337935804,
          0.48,
          -0.046724700378254054
        ],
        [
          -0.04809111004695296,
          -0.05121407068334519,
          -0.049468879178166385,
          0.0060440312605351204,
          -0.03590574058704078,
          -0.02420397961512208,
          -0.05950900093652308,
          0.48
        ]
      ],
      "bias": [
        -0.05666108102537691,
        0.05303779606707394,
        0.03854377194307745,
        -0.02058047231286764,
        0.04406297955662012,
        0.008050886755809188,
        -0.02517838004976511,
        -0.02026571930386126
      ],
      "readout": [
        0.22,
        -0.18,
        0.16,
        -0.12,
        0.18,
        -0.08,
        0.1,
        -0.1
      ]
    },
    "hidden": [
      0.6676289901835564,
      0.06488318582113033,
      0.6628672995391652,
      -0.23992317317790807,
      0.8015568846558482,
      0.6083936103829202,
      0.6324154745245772,
      -0.8819495931476835
    ],
    "memory": [
      {
        "bulletin": 0.5234185330584925,
        "momentum": 0.7389042198830242,
        "reliability": 0.85
      },
      {
        "bulletin": 0.5703778908733873,
        "momentum": 0.6431911946374991,
        "reliability": 0.85
      },
      {
        "bulletin": 0.6139638954639289,
        "momentum": 0.434652331585772,
        "reliability": 0.85
      },
      {
        "bulletin": 0.6539187686246944,
        "momentum": 0.4732166790471781,
        "reliability": 0.85
      },
      {
        "bulletin": 0.6900062075424751,
        "momentum": 0.4144603044251127,
        "reliability": 0.85
      },
      {
        "bulletin": 0.7220127823484421,
        "momentum": 0.5083990994231624,
        "reliability": 0.85
      }
    ],
    "cash": 6.1482104878307595,
    "units": 14.409736939607857,
    "fees": 0.015750934266291136,
    "lastMove": 1,
    "rng": 1219201438
  }
}
